Entity,Story,Year,Records_lost,Organisation,Method_of_leak,No_of_records_stolen,Data_sensitivity,Source_name,Interesting_story
Uber,"Occured Sep 2014. Revealed Feb 2015. Names & license plates of 50,000 driver partners.",2015,50000,tech,poor security,50000,1,Uber,n
Sanrio,"Security researcher was able to access a database of 3.3m of Sanrio's Sanriotown.com accounts, with links to other Sanrio Hello Kitty portals.",2015,3300000,web,poor security,3300000,20,CSO Online,n
Deep Root Analytics,A database of 198 million US voters has been exposed as a result of incorrect configuration. ,2015,198000000,web,poor security,198000000,20,"Reuters, UpGuard",n
RootsWeb,"Nov. Ancestry.com's community-driven site RootsWeb was exposed after passwords, email addresses and usernames were leaked from the server. ",2015,300000,web,poor security,300000,4000,Threat Post,n
Privatization Agency of the Republic of Serbia,A text file with personal data and financial documents were made publically available on their website. ,2016,5190396,government,accidentally published,519396,20,Share Conference,n
Syrian government,"Hacking outfit calling itself 'Cyber Justice Team' leaked 10GB of data from the government and private websites. Seems to be just data from old leaks, though.",2016,274477,government,hacked,274477,1,Softpedia,n
Minecraft,Players using the Lifeboat servers have had their email addresses and passwords leaked.,2016,7000000,web,hacked,7000000,1,Motherboard,n
Mossack Fonseca,"2.6TB of data on politicians, criminals, professional athletes etc leaked from law firm Mossack Fonseca, including emails, contracts, scanned documents, transcripts...",2016,11500000,legal,hacked,11500000,50000,PanamaPapers,y
Mail. ru,Two hackers attacked three game-related forums hosted by Russian company Mail.ru. ,2016,25000000,web,hacked,25000000,20,ZD Net,n
Fling,"A hacker claims to be selling info on sexual desires & preferences, as well as generic personal info, stolen from the dating site Fling. ",2016,40000000,web,hacked,40000000,4000,Europol,n
Turkish citizenship database,Turkish citizenship database has allegedly been hacked and leaked online.,2016,49611709,government,hacked,49611709,20,Business Insider,n
Philippines’ Commission on Elections,"After a message was posted on the COMELEC website by hackers from Anonymous, warning the government not to mess with the elections, the entire database was stolen and posted online. ",2016,55000000,government,hacked,55000000,50000,Trend Micro,n
Anthem ,"Feb 2015: Names, dates of birth, member ID/ social security numbers, addresses, phone numbers, email addresses and employment information.",2016,80000000,healthcare,hacked,80000000,20,Anthem Facts,y
VK,Over 100m user accounts were hacked and the data put up for sale online. A VK spokesperson has denied that the site was breached claiming the data for sale is old details no longer in use.,2016,100544934,web,hacked,100544934,4000,Motherboard,n
Wendys,Malware has been used in 1025 of Wendys restaurants to steal credit card data from customers. Its currently unknown how many individuals have been impacted.,2016,1025,retail,hacked,1025,300,ABC News,n
MySpace,"The same hacker who was selling LinkedIn user data now claims to have MySpace user data too, and lots of it. ",2016,164000000,web,hacked,164000000,1,Motherboard,n
Linux Ubuntu forums,NA,2016,2000000,web,hacked,2000000,1,Beta News,n
uTorrent ,"It's unclear what data has been breached, exactly, but uTorrent has advised passwords are probably compromised. ",2016,35000,web,hacked,35000,1,Torrent Freak,n
Banner Health,Hackers gained access to payment card data via food outlets at Banner Health locations.,2016,3700000,healthcare,hacked,3700000,300,Banner Health,n
Mutuelle Generale de la Police,Files uploaded to Google Drive by a malicious employee. Data included home addresses. The leak came two weeks after a French police officer was murdered by ISIS inspired attack.,2016,112000,healthcare,inside job,112000,50000,BBC News,n
World Check,"2014 version of World-Check, a database of suspected terrorists and criminals, leaked online. It's unclear what data the records include.",2016,2200000,media,poor security,2200000,300,The Stack,n
Uber,"Uber paid the hackers $100,000 to delete the stolen data. Chief security officer Joe Sullivan has resigned.",2016,57000000,app,hacked,57000000,1,BBC,n
Red Cross Blood Service,Info leaked includes data about at risk sexual behaviours,2017,550000,healthcare,accidentally published,550000,4000,ABC News,n
River City Media,"A dodgy backup has allegedly resulted in over a billion leaked email addresses, plus other personal info in some cases, and has exposed RCM's business plans & operations. ",2017,1370000000,web,accidentally published,700000000,20,Beta News,n
Quest Diagnostics,"Nov. The stolen data contained names, DOBs, lab results and some telephone numbers.",2017,34000,healthcare,hacked,34000,4000,Newsroom,n
Three,"Hackers broke into Three's customer database with the intention of fraudulently ordering handsets to sell on. They stole personal details, but no financial records or passwords were stored on the hacked system. ",2017,200000,telecoms,hacked,200000,20,Three,n
Wonga,Apr. Customers from the UK and Poland look to have been affected. ,2017,270000,financial,hacked,270000,50000,The Guardian,n
PayAsUGym,Dec. Fitness website hacked & email address published online.,2017,300000,web,hacked,300000,1,BBC News,n
DaFont,"May. Apparently the hacker found out others were selling the site's database, so he decided to get in on the action himself.",2017,700000,web,hacked,700000,4000,ZD Net,n
Brazzers,"Sept. 'The data contains 790,724 unique email addresses, and also includes usernames and plaintext passwords. (The set has 928,072 entries in all, but many are duplicates.'",2017,790724,web,hacked,790724,4000,Motherboard,n
Snapchat,Apr Indian hackers apparently leaked data they stole last year in response to Snapchat CEO allegedly stating they had no plans to expand to poor countries like India. Snapchat have yet to confirm any leak.,2017,1700000,app,hacked,1700000,1,BGR,n
Bell,Somebody claiming to be behind the attack has threatened Bell with more leaks if they dont cooporate. ,2017,1900000,telecoms,hacked,1900000,1,CBC,n
Cellebrite,Cellebrites main product is a device that rips data from mobile phones. 900GB of data was stolen from Cellebrite. The hackers got hacked. The number of records taken is unknown.,2017,3000000,tech,hacked,3000000,20,Motherboard,y
Clinton campaign,NA,2017,5000000,government,hacked,5000000,20,Tech Crunch,n
ClixSense,"Sept. The information stolen contains usernames, passwords, home addresses, payment histories, and other banking details.",2017,6600000,web,hacked,6600000,50000,Digital trends,n
Lynda.com,"Hackers breached a database that held records of contact info and courses viewed. No official statement yet on how many records were actually stolen, and no evidence yet of them having been published anywhere.",2017,9500000,web,hacked,9500000,1,Neowin,n
Interpark,July. South Korean police are blaming North Korea for stealing data in an attempt to obtain foreign currency. ,2017,10000000,web,hacked,10000000,20,NY times,n
Zomato,The hacker is selling the stolen dataset for around $1000. ,2017,17000000,web,hacked,17000000,4000,HackRead,n
Yahoo,User accounts have been hacked using forged cookies to log in without a password over a 2 year period. ,2017,32000000,web,hacked,32000000,4000,CNet,n
Weebly,"Feb. Usernames, passwords and IP addresses stolen, although passwords secured with bcrypt. ",2017,43000000,web,hacked,43000000,4000,Tech Crunch,n
Dailymotion,"85.2m email addresses extracted, but only 18.3m had associated passwords.",2017,85200000,web,hacked,85200000,1,ZDNet,n
Friend Finder Network,"Usernames, email addresses, passwords for sites including Adult Friend Finder and Penthouse.com. Passwords encrypted, but LeakedSource claims to be able to crack 99% of them.",2017,412000000,web,hacked,412000000,1,ZDNet / LeakedSource,n
Telegram ,"Despite Telegram's claims of super security, they've been hacked by a group called Rocket Kitten. ",2017,15000000,tech,hacked,15000000,1,Venture Beat,n
Hong Kong Registration and Electoral Office,the personal information of the citys 3.7 million voters was possibly compromised after the Registration and Electoral Office reported two laptop computers went missing at its backup venue for the chief executive election.,2017,3700000,government,lost / stolen device or media,3700000,20,SCMP,n
Aadhaar,"Nov. The personal information of more than a billion Indians stored in the world’s largest biometric database can be bought online for less than £6, according to an investigation by an Indian newspaper. The reporter who broke the story has been named in a criminal complaint filed by government agency responsible for the data. ",2017,1000000000,government,accidentally published,1000000000,300,Guardian,n
CEX,"A misconfigured spambot leaked full contact info & financial details, although the newest financial data dates to 2009. ",2017,2000000,retail,accidentally published,2000000,300,The Guardian,n
Instagram,"A bug exposed user's contact information. Instagram initially said it affected only verified accounts, but has now admitted non-verified users were also affected. Instagram hasn't confirmed numbers, but hackers say they have info from 6m accounts.",2017,6000000,web,hacked,6000000,1,The Verge,n
Equifax,"If you have a credit report, there’s a good chance that you’re one of the 143 million American consumers whose sensitive personal information was exposed in a data breach at Equifax, one of the nation’s three major credit reporting agencies.",2017,143000000,financial,hacked,143000000,50000,UK Gov,y
Nival,"A teen hacker has randomly hacked several Russian websites. In a statement, he claims the hack was revenge for the MH17 crash. The companies affected have not commented, however Troy Hunt, a security researcher, has confirmed its legit. Nival and KM.ru were both hacked. ",2017,1500000,web,hacked,1500000,4000,Motherboard,n
KM.ru ,"A teen hacker has randomly hacked several Russian websites. In a statement, he claims the hack was revenge for the MH17 crash. The companies affected have not commented, however Troy Hunt, a security researcher, has confirmed its legit. Nival and KM.ru were both hacked. ",2017,1500000,web,hacked,1500000,4000,Motherboard,n
Waterly,Jan 2017. Israel-based app contained a vulnerability in the sign-in process that could potentially expose user account details. The problem was fixed within 2 weeks of being identifiied. ,2017,1000000,app,poor security,1000000,300,Data Breaches,n
Swedish Transport Agency,"Information about all vehicles in the country (including military and police), made available to IT workers who hadn't been through usual security checks. The question of whether or not Sweden's national security was harmed is censored in the Säpo (Sweden's security police) report.",2017,3000000,government,poor security,3000000,50000,The Local,y
Spambot,"A misconfigured spambot has leaked over 7m records, although many of them are likely to be fake or repeated accounts.",2017,711000000,web,poor security,711000000,4000,The Guardian,n
SVR Tracking,"The leaked passwords were stored using SHA-1, a weak 20yr old hash program.",2017,540000,app,poor security,540000,4000,The Hacker News,n
Viacom,A misconfigured Amazon Web Server S3 cloud storage bucket was left wide open and public facing.,2017,3000000,web,hacked,3000000,4000,The Hacker News,n
TIO Networks,The company has not revealed what type of information was stolen. ,2017,1600000,financial,hacked,1600000,4000,Bleeping Computer,n
Al.type,Dec. The apps developer failed to secure the database server. ,2017,31000000,app,poor security,31000000,4000,ZDNet,n
Malaysian telcos & MVNOs,"Oct. Data from numerous Malaysian telco & MVNO providers, including Celcom, Digi, Umobile, Maxis, Friendi, Merchantrade Asia, Tunetalk, Redtone, XOX, Altel, PLDT & EnablingAsia has been leaked.",2017,46200000,telecoms,hacked,46200000,4000,LowYat,n
Malaysian medical practitioners,"Oct. Databases belonging to the Malaysian Medical Council (MMC), the Malaysian Medical Association (MMA), and the Malaysian Dental Association (MDA) have been leaked.",2017,81309,healthcare,hacked,81309,4000,LowYat,n
MBM Company,"Mar. Negligent storage of a customer database exposed full postal addresses, email addresses, IP addresses and plain-text passwords. ",2018,1300000,retail,poor security,1300000,4000,NextWeb,n
Orbitz,"Mar. An old version of the Orbitz website was hacked, exposing personal details and payment card info. Orbitz is now owned by Expedia. ",2018,880000,web,hacked,880000,300,US News,n
Aadhaar,Mar A security researcher discovered a system vulnerability which means that anybody could download private info on all Aadhaar users. The govt. department that deals with the database has denied the breach. ,2018,1100000000,government,poor security,1100000000,4000,ZDNet,n
Saks and Lord and Taylor,Apr. A known ring of cybercriminals implanted software into store cash registers siphoning off payment card details. The company has not divulged how many accounts have been affected but the research firm that identified the breach believe 5million records may have been stolen. ,2018,5000000,retail,hacked,5000000,300,NYTimes,n
Panerabread,"Customer records were available via the site for at least 8 months. Panerabread were alerted to the leak in Aug 2017, but didn't pull the site until Apr 2018. Panerabread claims 10k records were leaked, but security researchers put the figure at over 37 million. ",2018,37000000,retail,poor security,37000000,20,"Krebsonsecurity, Medium",n
MyFitnessPal,"Feb. Usernames, email addresses, and hashed user passwords were stolen. ",2018,150000000,app,hacked,150000000,1,Guardian,n
Twitter,"May. A glitch caused some passwords to be stored in readable text, visible on the internal computer system. ",2018,330000000,app,poor security,330000000,1,Reuters,n
