Entity,Story,Year,Records_lost,Organisation,Method_of_leak,No_of_records_stolen,Data_sensitivity,Source_name,Interesting_story
Sutter Medical Foundation,"A password protected but unencrypted company computer was stolen. The compromised database contained names, addresses, dates of birth, phone numbers, email addresses, medical record numbers and the name of each patient's health insurance plan. No medical records were stored on the computer.",2011,4243434,healthcare,lost / stolen device or media,4200000,20,US Gov,n
Tricare,"The information for some 4.6 million active and retired military personnel, as well as their families, was on back up-tapes from an electronic health care record used to capture and preserve patient data from 1992 through September 7 2011. ",2011,4901432,"military, healthcare",lost / stolen device or media,4900000,4000,ITRC,n
NHS,A laptop holding the unencrypted records of eight million patients went missing from an NHS store room and wasnt reported until 3 weeks later. ,2011,8300000,healthcare,lost / stolen device or media,8300000,4000,Tech Week,y
Accendo Insurance Co. ,"Mismailed letters which allowed some lines of sensitive information (medication name, date of birth, and member ID) to be visible through the envelope window. The mailings were addressed correctly and, to the knowledge of the company, were received by the intended recipients.",2011,175350,healthcare,poor security,180000,20,US Gov,n
Office of the Texas Attorney General,The office of Texas Attorney General Greg Abbott mistakenly gave attorneys access to millions of Social Security numbers in a case against the state’s voter ID law,2012,6500000,government,accidentally published,6500000,20,Raw Story,n
Apple,Hacking group AntiSec claimed they hacked an FBI laptop in March 2012 accessing a file of more than 12 million Apple Unique Device Identifiers (UDIDs). Subsequently it was discovered that app developer BlueToad was the source of the breach. The list contained personal information such as full names phone numbers and addresses. AntiSec published a million of these UDIDs online.,2012,12367232,"tech, retail",accidentally published,12400000,20,CNET,y
Dropbox,NA,2012,30000,web,hacked,30000,1,Information Week,n
Militarysingles, IP addresses and passwords of single military personnel.,2012,163792,"web, military",hacked,180000,1,PC World,n
Formspring,"Formspring was tipped off to a breach after 420,000 hashed passwords were posted to a security forum. ",2012,420000,web,hacked,400000,1,CNet,y
Yahoo Voices,"Yahoo Voices service was hacked, exposing more than 450,000 usernames and passwords.",2012,450000,"tech, web",hacked,500000,1,Slashdot,n
Medicaid,The Utah Department of Technology Services had recently moved their claims records to a new server and hackers believed to be operating out of Eastern Europe were able to circumvent the servers multilayered security system containing Social Security numbers for the Medicaid claims.,2012,780000,government healthcare,hacked,800000,20,ITRC,y
Global Payments,1.5 million credit card numbers from its systems may have been exposed after detecting unauthorized access into its processing system. ,2012,7000000,financial,hacked,1500000,300,ITRC,n
Three Iranian banks,After finding a security vulnerability in Irans banking system software manager Khosrow Zarefarid wrote a formal report and sent it to the CEOs of all the affected banks across the country. When the banks ignored his findings he hacked 3 million bank accounts belonging to at least 22 different banks to prove his point.,2012,3000000,financial,hacked,3000000,50000,ZD Net,y
"LinkedIn, eHarmony, Last.fm","Hacker 'dwdm' uploaded a file containing 6.5 million passwords on a Russian hacker forum. Soon after another 1.5 million passwords were discovered.  On analysis, 93% of the passwords could be found in the Top 10,000 password list.",2012,8000000,web,hacked,8000000,1,Cnet,n
Gamigo,German gaming website,2012,8000000,web,hacked,8000000,1,Forbes,n
KT Corp.,"Two suspects reportedly earnt an estimated $877,000 by selling the contact information and plan details of 8.7 million KT subscribers, almost half of the carrier's total customers.",2012,8700000,telecoms,hacked,8700000,20,Korea Times,n
Greek government,"A computer programmer was arrested in Greece for allegedly stealing the identity information of what could amount to 83% of the country's population. The 35-year-old was found in possession of 9 million data files containing identification card data, addresses, tax ID numbers and licence plate numbers, which he was also suspected of trying to sell.",2012,9000000,government,hacked,9000000,20,Wired,n
Blizzard,Scrambled passwords email addresses and personal security answers were knowingly stolen from Blizzards internal network. Blizzard would not elaborate on the size of the hack millions.,2012,14000000,gaming,hacked,14000000,20,Blizzard,n
Zappos,NA,2012,24000000,web,hacked,24000000,20,Forbes,n
Last.fm,"Historical 2012 hack, details have only just been disclosed.",2012,43500000,web,hacked,43500000,1,ZD Net,n
Dropbox,"User credentials were stolen in a 2012 hack, but the number affected has only just come to light. ",2012,68700000,web,hacked,68700000,1,The Telegraph,n
Massive American business hack,"Over eight years, a hacking ring targeted banks, payment processors and chain stores, to steal more than 160 million credit and debit card numbers, targeting more than 800,000 bank accounts ",2012,160000000,financial,hacked,160000000,50000,NY Daily,y
LinkedIn,Information about a 2012 data breach has just come to light. ,2012,117000000,web,hacked,117000000,1,CNN,n
South Carolina State Dept. of Revenue,A server was breached by an international hacker.,2012,3600000,government,hacked,3600000,3,Information Week,n
South Carolina Government,"A man was charged with five counts of violating medical confidentiality laws and one count of disclosure of confidential information after he gained access to personal information for more than 228,000 Medicaid beneficiaries.",2012,6400000,healthcare,inside job,200000,4000,US Gov,n
New York State Electric & Gas,An employee from a software consulting firm was allowed unauthorized access to the company’s databases.,2012,1800000,energy,inside job,1800000,20,ITRC,n
Court Ventures,"A Vietnamese identity theft service was sold personal records, including Social Security numbers, credit card data and bank account information, by Court Ventures, a company now owned by data brokerage firm Experian.",2012,200000000,financial,inside job,200000000,20,NY Times / Experian,n
Emory Healthcare,"The company 'misplaced' 10 discs containing sensitive information, including social security numbers. ",2012,315000,healthcare,lost / stolen device or media,300000,4000,US Gov,n
California Department of Child Support Services,California child support records were lost in transit during a disaster preparedness exercise.,2012,800000,government,lost / stolen device or media,800000,20,ITRC,n
Disqus,"hackers 17.5m email addresses in July 2012. About a third of those accounts contained passwords, which were hashed using the dated SHA-1 algorithm",2012,17500000,web,hacked,17500000,4000,ZD Net,n
Citigroup,Third big data breach from Citigroup.The personal information of 150000 consumers who went into bankruptcy between 2007 and 2011  including their social security numbers  were exposed after Citi failed to properly redact court records before they were put on the Public Access to Court Electronic Records (PACER) system.,2013,150000,financial,accidentally published,150000,20,Softpedia,y
TerraCom YourTel,The telecom firms TerraCom and YourTel have branded reporters for Scripps News as hackers after journalists discovered that the personal data of over 170000 customers including social security numbers and other identifying data that could be used for identity theft were sitting on a publicly accessible server.,2013,170000,telecoms,accidentally published,180000,20,Boing Boing; Wired,y
NMBS,Data stored on a non secure server making it possible to access names gender DOB email and postal address data of customers externally by means of a simple search engine query. Most of the data belong to customers in Belgium France and the UK including thousands of Commission and Parliament employees.  Caused the NMBS said by a data worker clicking on the wrong button.,2013,1460000,transport,accidentally published,1500000,20,European Parliament,n
Facebook,Using the networks Download Your Information tool some Facebook members were inadvertently sent the phone numbers or email address of Facebook friends that were otherwise private. Facebook assured users that the bug was fixed within a day and that there is no evidence that the information was used maliciously.,2013,6000000,web,accidentally published,6000000,1,Facebook,n
Central Hudson Gas & Electric,Customer banking information and other personal information may have been accessed during the hack.,2013,110000,energy,hacked,100000,300,Privacy Rights,n
Kirkwood Community College,NA,2013,125000,academic,hacked,130000,20,Privacy Rights,n
Washington State court system,"Up to 160,000 Social Security numbers and a million driver's license numbers may have been accessed by hackers exploiting old versions of Adobe Cold Fusion software on the server. ",2013,160000,government,hacked,160000,20,Reuters; Privacy Rights,n
Nintendo,Japans Club Nintendo service was hacked following thousands of unauthorized accesses. Customer information compromised in the attack includes full names phone numbers home and email addresses.,2013,240000,gaming,hacked,250000,20,JoyStiq,n
Apple,Developer portal hacked. Some information about 275000 3rd party developers potentially stolen.,2013,275000,tech,hacked,300000,1,The Guardian,n
OVH,NA,2013,NA,web,hacked,500000,20,OVH,n
Scribd,Hack resulted in a few hundred thousand stolen passwords.,2013,500000,web,hacked,500000,1,Naked Security; NBC News,n
Drupal,"Malicious files placed on association.drupal.org servers via a 3rd-party application. Exposed usernames, e-mail addresses, country information, and cryptographically hashed passwords.",2013,1000000,web,hacked,1000000,1,Ars Technica,n
Ubuntu,July 2013: Discussion forum for the operating system was compromised leaking personal details and password. The passwords were cryptographically scrambled using the MD5 hashing algorithm - considered an inadequate means of protecting stored passwords by security experts.,2013,2000000,tech,hacked,2000000,300,Data Loss Database,y
ssndob.ms,"SSNDOB was an underground identity theft service. Teenage hackers used it to collect data for exposed.su, a site that listed the SSNs, birthdays, phone numbers, current and previous addresses for dozens of top celebrities including Beyonce, Kanye West and Michelle Obama. In doing so they revealed SSNDOB had data on more than 4 million people.",2013,4000000,web,hacked,4000000,20,Krebs on Security,y
SnapChat,"31st Dec 2013. Hackers abused an exploit to syphon 4.7m user details, including phone numbers.  Check here to see if your account was compromised: http://lookup.gibsonsec.org/",2013,4700000,"web, tech",hacked,4700000,20,Forbes,n
Yahoo Japan,22 million Yahoo user IDs may have been leaked after Yahoo detected an unauthorized attempt to access the administrative system of its web portal Yahoo Japan. The leaked information did not include passwords and data necessary for identity verification to reset passwords.,2013,22000000,"tech, web",hacked,22000000,1,Reuters,n
Adobe,"Sep 17th 2013. Hackers obtained access to a large swathe of Adobe customer IDs and encrypted passwords & removed sensitive information (i.e. names, encrypted credit or debit card numbers, expiration dates, etc.). Approximately 36 million Adobe customers were involved: 3.1 million whose credit or debit card information was taken and nearly 33 million active users whose current, encrypted passwords were in the database taken. Correction Jan 2015: we previously reported 152m records were taking, but the remainder affected invalid, inactive, test accounts or had out-of-date passwords associated with them.",2013,36000000,tech,hacked,36000000,50000,Adobe,y
Evernote,"Evernote asked its 50 million users to reset their passwords following an attempt to hack the note-taking network. The company said it’d found no evidence that any payment information for Evernote Premium or Evernote Business customers had been accessed, nor was there any indication that content stored by users had been accessed, changed or lost.",2013,50000000,web,hacked,50000000,1,Wired; Digital Trends,n
Living Social,"Online criminals gained access to user names, e-mail addresses, dates of birth & encrypted passwords for 50 million people. Databases storing financial information were not compromised in the attack, the company said.",2013,50000000,web,hacked,50000000,1,Naked Security; New York Times,n
UbiSoft,NA,2013,NA,gaming,hacked,58000000,20,UBI,n
Yahoo,"Happened in 2013 but only disclosed late 2016. Data included names, telephone numbers, DOBs, passwords and security questions. ",2013,1000000000,web,hacked,1000000000,20,NY Times,n
Tumblr,"Tumblr apparently only just found out about a 2013 data breach, affecting 65m users. ",2013,65000000,web,hacked,65000000,1,Motherboard,n
Twitter,"Hackers had access to limited user information -- usernames, email addresses, session tokens and encrypted/salted versions of passwords -- for approximately 250,000 users.",2013,250000,web,hacked ,250000,1,Wired,n
National Security Agency,"Snowden downloaded up to 1.5 million files, then flew to Hong Kong to meet journalists Glenn Greenwald and Laura Poitras before fleeing to Moscow. ",2013,1500000,government,inside job,1500000,50000,Business Insider,y
Kissinger Cables,Wikileaks,2013,1700000,government,inside job,1700000,300,Wikileaks,n
Vodafone,An IT contractor for the firm used his deep access to the telecom giants system to copy customer names and bank account details.,2013,2000000,telecoms,inside job,2000000,300,Security Week,y
"Crescent Health Inc., Walgreens","Names, Social Security numbers, health insurance identification numbers, health insurance information, dates of birth, diagnoses, other medical information, disability codes, addresses, and phone numbers may have been exposed via a laptop theft.",2013,100000,healthcare,lost / stolen device or media,100000,4000,Privacy Rights,n
Florida Courts,NA,2013,100000,government,lost / stolen device or media,100000,20,Privacy Rights,n
Florida Department of Juvenile Justice,"Three computers were stolen that contained both youth and employee records was reported stolen on January 2, 2013.  Over 100,000 records were on the device and may have been exposed.",2013,100000,government,lost / stolen device or media,100000,20,Privacy Rights,n
Advocate Medical Group,"4,000,000 patient names, addresses, dates of birth, and Social Security numbers were contained in four computers stolen from an administrative building. Second biggest security breach ever reported to the Department of Health and Human Services (HHS).",2013,4000000,healthcare,lost / stolen device or media,4000000,20,Health IT Security,y
Indiana University,Students who attended the university between 2011 and 2014 may have had their data exposed after it was stored on an unprotected site. The data was accessed by three webcrawlers but there is not evidence it was accessed by any unauthorized individuals.,2013,146000,academic,poor security,150000,20,Indiana University,n
NASDAQ,"Nasdaq forum website hacked by hacking ring, email addresses and passwords compromised",2014,500000,financial,hacked,500000,1,Reuters,y
Dominios Pizzas (France),NA,2014,600000,web,hacked,600000,1,The Guardian,n
Japan Airlines,"Oct 2014: Japan Airlines confirmed the possible theft of information from up to around 750,000 frequent-flier programme members. Data that may have been stolen included names, genders, birth dates, addresses, email addresses and places of work.",2014,750000,transport,hacked,800000,20,WSJ,n
MacRumours.com,NA,2014,860000,web,hacked,900000,1,Wired,n
"D&B, Altegrity","Hackers stole millions of social security numbers from large US data brokers Dun & Bradstreet Corp and Kroll Background America Inc, owned by Altegrity. Correction 7 Jan 2015: we previously stated that records were stolen from LexisNexis. LexisNexis conducted a thorough investigation of the malware intrusion and found no evidence that the malware accessed or stole any customer or consumer data. ",2014,1000000,tech,hacked,1000000,300,USA Today; Reuters; BBC News,n
Neiman Marcus,NA,2014,1100000,retail,hacked,1100000,20,NY Times,n
Staples,NA,2014,1160000,retail,hacked,1200000,300,Fortune,n
European Central Bank,NA,2014,4000000,financial,hacked,4000000,1,City am,n
UPS,Malware was discovered in the credit & debit card processing systems at 51 branches in 24 states.,2014,4000000,retail,hacked,4000000,300,Time,n
Community Health Systems,Aug 2014 Community Health Systems which operates 206 hospitals across the US had patient data from the last 5 years breached. Details included names addresses social security numbers. Suspected chinese hackers were thought responsible. Goal identity theft.,2014,4500000,healthcare,hacked,4500000,20,CNN,y
Gmail,5 million Gmail account passwords leaked to a forum alongside passwords from other email providers. Close inspection revealed the user details to be old (3+ years). Multiple individual targeted hacks of third party websites where people used their Gmail IDs rather than one big dataleak suspected to be the method. Gmail itself was not hacked. ,2014,5000000,web,hacked,5000000,1,The Next Web,y
Sony Pictures,Wide ranging hack of potentially every piece of data held by the company including unreleased films and scripts employee social security numbers salaries and health check results as well as sensitive internal business documents relating to layoffs restructures and executive salaries. Lead suspects are North Korean hackers perhaps related to the Seth Rogen film The Interview which mocks the North Korean dictator Kim Jong Un.,2014,10000000,media,hacked,10000000,20,Buzzfeed,n
Twitch, March 23rd. Details unknown at this point. All Twitchs 10 million users have been requested to change their passwords.,2014,10000000,healthcare,hacked,10000000,1,Twitch,n
AOL,NA,2014,2400000,web,hacked,24000000,1,AOL,n
Home Depot,"Malware installed on cash register system across 2,200 stores syphoned credit card details of up to 56 million customers. May be the same group of Russian and Ukrainian hackers responsible for the data breaches at Target, Sally Beauty and P.F. Chang’s, among others",2014,56000000,retail,hacked,56000000,300,Krebs on Security,y
Target,Investigators believe the data was obtained via software installed on machines that customers use to swipe magnetic strips on their cards when paying for merchandise at Target stores. Originally 40m customers. Now 70m!,2014,70000000,retail,hacked,70000000,300,Chicago Tribune,y
JP Morgan Chase,"July 2014: The US's largest bank was compromised by hackers, stealing names, addresses, phone numbers and emails of account holders. The hack began in June but was not discovered until July, when the hackers had already obtained the highest level of administrative privilege to dozens of the bank’s computer servers.",2014,76000000,financial,hacked,76000000,300,Deal Book,y
Ebay,The company has said hackers attacked between late February and early March with login credentials obtained from a small number of employees. They then accessed a database containing all user records and copied a large part of those credentials.,2014,145000000,web,hacked,145000000,1,Chicago Tribune,y
Yahoo,"Happened in 2014, but no. records stolen was originally thought to be much smaller. Yahoo recently revealed the real numbers.",2014,500000000,web,hacked,500000000,20,Business Insider,n
HSBC Turkey,In a message to customers on its website the bank said an attack on its credit card and debit card systems in Turkey had been thwarted but card numbers account numbers card expiry dates and customer names had been compromised.,2014,2700000,financial,hacked,2700000,50000,Reuters,n
Korea Credit Bureau,NA,2014,20000000,financial,inside job,20000000,50000,Security Week,n
New York Taxis,"A freedom of information request resulted in the release of data on all 173 million journeys undertaken by New York taxis in one year. Unfortunately, the data was incorrectly anonymised and relatively easy to decode, revealing the driver IDs, pickup & dropoff times, and GPS routes taken for every single cab journey.",2014,52000,transport,poor security,52000,1,Medium,y
Mozilla,NA,2014,76000,web,poor security,800000,20,The Guardian,n
Imgur,"Imgur are still investigating how the breach took place. The data was stolen in 2014, but Imgur claim they only discovered it in Nov 2017. ",2014,1700000,app,hacked,1700000,4000,Imgur,n
Facebook,"Cambridge Analytica, headed at the time by Steve Bannon, harvested 50m profiles in early 2014 to build a system that could profile US voters and target them with political adverts. ",2014,50000000,web,hacked,50000000,1,Guardian,n
Australian Immigration Department,"An employee of the agency inadvertently sent the passport numbers, visa details and other personal identifiers of all world leaders attending the G20 Brisbane summit to the organisers of the Asian Cup football tournament. Barack Obama, Vladimir Putin, Angela Merkel, Xi Jinping, Narendra Modi, David Cameron and many others.",2015,500000,government,accidentally published,500000,50000,The Guardian,n
Invest Bank,"Hacker breached a United Arab Emirates bank, demanding a ransom of $3m in bitcoin to stop tweeting data, mostly about corporate accounts. The hacker dumped files on the website of a basketball team, which he hacked for storage. The bank, Invest Bank, won't pay the ransom.  ",2015,40000,financial,hacked,40000,50000,Daily Dot ,n
IRS,An unnamed cybermafia used an IRS app to download forms full of personal information. They posed as legitimate taxpayers and tried to download forms on 200000 people between February and May. They got away with half of them the IRS said. The crooks used about 15000 of them to claim tax refunds in other peoples names.,2015,100000,government,hacked,100000,1,CNN,n
TalkTalk,"157k customers had personal details stolen, including 15,600 account numbers. ",2015,157000,web,hacked,160000,20,BBC News,n
MSpy,Data dump to the dark web includes Apple IDs and passwords tracking data and payment details on some 145000 successful transactions photos and very private conversations.,2015,400000,tech,hacked,400000,20,Krebs on Security,n
British Airways,NA,2015,500000,retail,hacked,500000,1,The Guardian,n
Hacking Team,"Italian cybersecurity firm sells digital surveillance software to law enforcement and national security organisations. 400 GB of documents - including software source code, private messages & client databases - has been stolen and put online  via BitTorrent. The documents show the company has sold products to repressive regimes.",2015,500000,web,hacked,500000,50000,The Guardian,y
Slack,NA,2015,500000,tech,hacked,500000,1,Tech Crunch,n
Carefirst,Attacked happened in June 2014. Was announced in June 2015.,2015,1100000,healthcare,hacked,1100000,1,Carefirst,n
CarPhone Warehouse,NA,2015,2700000,web,hacked,2700000,50000,The Guardian,n
Adult Friend Finder,"Sexual preferences, names, email addresses, usernames, dates of birth, postal codes",2015,3900000,web,hacked,3900000,1,Channel 4,n
US Office of Personnel Management,The intruders gained access to employees Social Security numbers job assignments performance ratings and training information,2015,4000000,government,hacked,4000000,20,Washington Post,n
VTech,"Software used to download games to children's computer tablets was hacked, with personal info and photos stolen. ",2015,6400000,web,hacked,6400000,50000,The Guardian,n
Premera,Detected 29th Jan 2015. Occured May 2014. C could include names date of birth email address address telephone number Social Security number member identification numbers bank account information and claims information including clinical information,2015,11000000,healthcare,hacked,11000000,50000,Premera,n
Kromtech,"A security researcher stumbled on a leak, which exposed usernames, email addresses and passwords of users. He notified Kromtech, who patched it quickly. ",2015,13000000,web,hacked,13000000,1,The Stack,n
Experian / T-mobile,"The world's biggest data monitoring firm disclosed a massive breach of customers who applied for service with T-Mobile. Names, addresses, birth dates, Social Security numbers, drivers license numbers and passport numbers.",2015,15000000,web,hacked,15000000,300,Reuters,n
US Office of Personnel Management (2nd Breach),"attackers have targeted the forms submitted by intelligence and military personnel for security clearances. The document includes personal information - everything from eye colour, to financial history, to past substance abuse, as well as contact details for the individual's friends and relatives",2015,21500000,government,hacked,21500000,50000,BBC News,n
AshleyMadison.com,"20th July 2015: DEVELOPING: Online hookup site for extra-marital affairs has been severely breached and the personal details of 37m users, as well as company financial records, threatened with release. Notorious hacking outfit The Impact Team has claimed responsibility. The hackers are demanding the shutdown of AM.com and other associated sites.",2015,37000000,web,hacked,37000000,1,Krebs on Security,n
Securus Technologies,"Anonymous hacker leaked records of over 70m phone calls, plus links to recordings. Recording/storing attorney-client calls potentially violates constitutional protections.",2015,70000000,web,hacked,70000000,50000,The Intercept,n
