Entity,Story,Year,Records_lost,Organisation,Method_of_leak,No_of_records_stolen,Data_sensitivity,Source_name,Interesting_story
AOL,A former America Online software engineer stole 92 million screen names and e-mail addresses and sold them to spammers who sent out up to 7 billion unsolicited e-mails.,2004,92000000,web,inside job,92000000,1,CNN,n
Cardsystems Solutions Inc. ,"CardSystems was fingered by MasterCard after it spotted fraud on credit card accounts and found a common thread, tracing it back to CardSystems.  An unauthorized entity put a specific code into CardSystems' network, enabling the person or group to gain access to the data. It's not clear how many of the 40 million accounts were actually stolen. ",2005,40000000,financial,hacked,40000000,300,MSNBC,y
Ameritrade Inc.,online broker,2005,200000,financial,lost / stolen device or media,200000,20,NBC,n
Citigroup,Blame the messenger! A box of computer tapes containing information on 3.9 million customers was lost by United Parcel Service (UPS) while in transit to a credit reporting agency.,2005,3900000,financial,lost / stolen device or media,3900000,300,NY Times,y
Automatic Data Processing,NA,2005,125000,financial,poor security,130000,20,ABC,n
AOL,"Durp. AOL VOLUNTARILY released search data for roughly 20 million web queries from 658,000 anonymized users of the service. No one is quite sure why.",2006,20000000,web,accidentally published,20000000,1,Tech Crunch,y
KDDI,Press reportTokyo police have arrested two men for trying to extort nearly US$90000 from KDDI Corp. The pair allegedly threatened to disclose the existence of storage media containing personal data belonging to four million KDDI customers prior to a shareholder meeting however KDDI alerted the police as soon as they were contacted by the blackmailers the police monitored communications between KDDI and the pair for several weeks.,2006,4000000,telecoms,hacked,4000000,1,Computer World,y
Countrywide Financial Corp,NA,2006,2600000,financial,inside job,2600000,300,ITRC,n
Hewlett Packard,Laptop loststolen containing employee data names addresses Social Security numbers dates of birth and other employment related information.,2006,200000,tech retail,lost stolen device or media,200000,20,CNET,y
"T-Mobile, Deutsche Telecom","Thieves got their hands on a storage device with the data, which included the names, addresses, cell phone numbers, and some birth dates and e-mail addresses for high-profile German citizens. The company said the records did not contain bank details, credit card numbers, or call data.",2006,17000000,telecoms,lost / stolen device or media,17000000,1,Data Loss Database,n
US Dept of Vet Affairs,The Veterans Affairs Department agreed to pay $20 million to settle a class action lawsuit over the loss of a laptop. The department originally took three weeks to report the theft. The laptop was recovered with the data apparently intact a month after it was reported stolen. But it is impossible to say with absolute certainty that the data was not accessed and copied.  ,2006,26500000,"government, military",lost / stolen device or media,26500000,20,GCN,n
Monster.com,A trojan virus stole logins that were used to harvest user names email addresses home addresses and phone numbers. Soon after phishing emails encouraged users to download a Monster Job Seeker Tool which was in fact a program that encrypted files in their computer and left a ransom note demanding money for their decryption.,2007,1600000,web,hacked,1600000,20,BBC,y
Hannaford Brothers Supermarket Chain,An estimated 4.2 million credit and debit card numbers were stolen.,2007,4200000,retail,hacked,4200000,300,ITRC,n
TD Ameritrade,TD Ameritrade settled a class action lawsuit to compensate as many as 6.3 million TD Ameritrade customers whose data was stolen by hackers costing the Nebraska online brokerage firm less than $2 per victim.,2007,6300000,financial,hacked,6300000,1,Wired,n
TK / TJ Maxx,"Hackers hacked a Minnesota store wifi network and stole data from credit and debit cards of shoppers at off-price retailers TJX, owners of nearly 2,500 stores, including T.J. Maxx and Marshalls. This case is believed to be the largest such breach of consumer information.",2007,94000000,retail,hacked,94000000,300,ZD Net,n
Texas Lottery,Data on more than 89000 lottery winners (including names Social Security numbers addresses and prize amounts )were taken from the agency without permission by a former computer analyst who copied the password-free data. The employee added he wanted the information for possible future reference as a programmer at other state agencies.,2007,89000,government,inside job,90000,20,ITRC,n
Compass Bank,"A former employee stole a hardrive containing 1m account details from the bank, then used it to defraud cutomers of nearly $32,000.",2007,1000000,financial,inside job,1000000,300,ITRC,y
Fidelity National Information Services,NA,2007,8500000,financial,inside job,8500000,300,PCWorld,n
Dai Nippon Printing,"A former contractor of Dai Nippon Printing Company in Tokyo, Japan stole 8.6 million records containing the personal data of customers of 43 of the company's clients. ",2007,8637405,retail,inside job,8600000,1,USA Today,n
City and Hackney Teaching Primary Care Trust,Heavily encrypted disks containing details of children are lost by couriers.,2007,160000,government,lost / stolen device or media,160000,20,Computer Weekly,n
Gap Inc,"Stolen laptop which contained social security numbers, data on people who applied for positions at Gap stores, including Banana Republic and Old Navy, between July 2006 and June 2007.",2007,800000,retail,lost / stolen device or media,800000,20,PC World,n
Driving Standards Agency,"Hard disk with details of candidates for the driving theory test was lost in a premises in Iowa by subcontractors. Only names, addresses and phone numbers. ",2007,3000000,government,lost / stolen device or media,3000000,20,BBC News,n
"Driving Standards Agency,",NA,2007,3000000,government,lost / stolen device or media,3000000,20,BBC News,n
UK Revenue & Customs,A set of discs containing confidential details of 25 million child benefit recipients was lost.,2007,25000000,government,lost / stolen device or media,25000000,1,BBC News,n
Jefferson County,Jefferson County Clerk Jennifer Maghan said she unveiled a new online search tool that enabled residents and business professionals to access nearly 1.6 million documents that are stored in her office via their home computers,2008,1600000,government,accidentally published,1600000,20,ITRC,y
Norwegian Tax Authorities,Tax authorities said they had accidentally sent CD-ROMs filled with the 2006 tax returns of nearly four million people living in Norway a country of just 4.6 million inhabitants to the editorial staff at national newspapers radios and television stations.,2008,3950000,government,accidentally published,4000000,20,Info Watch,y
RBS Worldpay,"The hack primarily effected U.S. prepaid and the gift card issuing business of RBS Worldpay. Actual fraud has been committed on approximately 100 cards.  Certain personal information of approximately 1.5 million cardholders and other individuals may have been affected and, of this group, Social Security numbers of 1.1 million people may have been accessed.",2008,1500000,financial,hacked,1500000,20,The Register,n
Data Processors International,NA,2008,5000000,financial,hacked,5000000,1,CNN,n
Chile Ministry Of Education,A computer hacker in Chile published confidential records belonging to six million people to illustrate the weakness of their security. ,2008,6000000,government,hacked,6000000,1,BBC News,n
Auction,NA,2008,18000000,web,hacked,18000000,300,Dark reading,n
GS Caltex,"Two multimedia discs containing the names, social security numbers, addresses, cell phone numbers, email addresses and workplaces of Korean customers sorted by age were stolen. They were found by an office worker in a backstreet’s trash pile in Seoul. Experts say a GS Caltex employee likely stole the information for personal purposes given there were no signs of hacking.",2008,11100000,energy,inside job,11100000,20,Data Loss Database,n
Service Personnel and Veterans Agency (UK),Stolen USBs containing personal information about private lives of staff. ,2008,50500,government,lost / stolen device or media,50000,20,BBC News,n
Stanford University,"Tens of thousands of past and current Stanford University employees had personal information - including their dates of birth, Social Security numbers and home addresses - stored on the hard drive of a stolen university laptop.",2008,72000,academic,lost / stolen device or media,72000,20,ITRC,n
UK Home Office,"PA Consulting lost an unencrypted memory stick containing details of high risk, prolific and other offenders.",2008,84000,government,lost / stolen device or media,84000,20,Wikipedia,n
ATT,A laptop was stolen from a car containing unencrypted Social Security numbers and bonussalary info of AT&T employees.,2008,113000,telecoms,loststolen device or media,100000,1,ITRC,y
Starbucks,"A laptop was stolen that contained private information on 97,000 employees, including names, addresses and Social Security numbers. Employees tried to sue Starbucks in California winning their case in the appeals court before losing in the higher federal court as they were unable to prove any cognizable harm or injury.",2008,97000,retail,lost / stolen device or media,100000,20,ITRC,y
UK Ministry of Defence,"Hard drive containing very sensitive details of Armed Forces personnel - passport & national insurance numbers, bank details etc - went missing. Loss was revealed during National Identity Fraud Prevention Week. ",2008,1700000,government,lost / stolen device or media,1700000,50000,BBC News,y
University of Miami,Thieves stole a briefcase containing data tapes out of a vehicle used by a private offsite storage company. Anyone who had been a patient of a University of Miami physician or visited a UM facility since 1999 is likely included on the tapes. The data included names addresses Social Security numbers and health information. 47000 of these records may have included credit card or other financial information regarding bill payment.,2008,2100000,academic,lost / stolen device or media,2100000,300,ITRC,n
University of Utah Hospitals Clinics,The data tapes were stolen by petty thieves from an employees car. According to police reports the thieves tried - and failed - to view the tapes using a VHS player.,2008,2200000,academic,lost / stolen device or media,2200000,4000,ITRC,y
BNY Mellon Shareowner Services,"A back-up tape, containing over 12 million customers records were lost.",2008,12500000,financial,lost / stolen device or media,12500000,1,ITRC,n
University of California Berkeley,NA,2009,160000,academic,hacked,160000,300,ITRC,n
Virginia Prescription Monitoring Program,"A hacker, who was never arrested, demanded a $10 million ransom for a breach effecting 530,000 Virginians. Social security numbers may have been taken. The data was found in a database containing 35 million prescription records.",2009,531400,healthcare,hacked,500000,20,ITRC,y
Network Solutions,"A large-scale infection of WordPress-driven blogs with malicious code led to the compromise of 573,000 debit and credit cards.",2009,573000,tech,hacked,600000,300,ITRC,n
CheckFree Corporation, Customers who went to CheckFrees Web sites between 12 35 am and 10 10 am on the day of the attack were redirected to a Ukrainian Web server that used malicious software to try and install a password stealing program on the victims computer.,2009,5000000,financial,hacked,5000000,1,Computer World,y
Virginia Dept. Of Health,An extortion demand posted on WikiLeaks sought $10 million to return over 8 million patient records and 35 million prescriptions allegedly stolen from Virginia Department of Health Professions.  All 36 servers were shut down  to protect records.,2009,8257378,"government, healthcare",hacked,8300000,4000,ITRC,y
RockYou!,"The site did not allow users to use special characters or punctuation in their passwords and e-mailed user passwords in plain text. Hackers took advantage of these security lapses, using simple techniques to gain access to 32 million user accounts.",2009,32000000,"web, gaming",hacked,32000000,1,Tech Crunch,y
Heartland,"The biggest credit card scam in history, Heartland eventually paid more than $110 million to Visa, MasterCard, American Express and other card associations to settle claims related to the breach.",2009,130000000,financial,hacked,130000000,300,Guardian,y
US Dept of Defense,According to a report to Congress assessment forms of 72000 service members who returned from deployment to Iraq or Afghanistan between Jan 1 2007 to May 31 2008 were breached. The forms ask for the service members SSN. Name date of birth.,2009,72000,military,lost / stolen device or media,72000,20,ITRC,y
US National Guard,"About 131,000 former and current Army Guard members potentially affected  when a personal laptop owned by an Army Guard contractor was stolen. Database incuded names, Social Security Numbers, incentive payment amounts and payment dates.",2009,131000,military,lost / stolen device or media,130000,20,ITRC,y
"Affinity Health Plan, Inc.",A rented photocopier used to copy health records did not have its hard-drive wiped before its return. ,2009,344579,healthcare,lost / stolen device or media,300000,4000,US Gov,y
Blue Cross Blue Shield of Tennessee,"A thief stole 57 hard drives from the closet of a BlueCross call center in Chattanooga, Tenn. Data on the stolen hard drives was encoded but not encrypted. Bluecross stated there was no evidence the information was accessed due to the specialized nature of the hardware stolen. ",2009,1023209,healthcare,lost / stolen device or media,1000000,20,US Gov,y
"AvMed, Inc.","Two company laptops containing names, addresses, dates of birth, Social Security numbers and health-related information. ",2009,1220000,healthcare,lost / stolen device or media,1200000,20,US Gov,n
Health Net ,A portable hard drive with seven years of personal and medical information on about 1.5 million Health Net customers was lost for six months before being reported. ,2009,1500000,healthcare,lost / stolen device or media,1500000,4000,ITRC,y
US Military,"Without first destroying the data the agency sent back a defective unencrypted hard drive for repair and recycling which held detailed records on 76 million veterans, including millions of Social Security numbers dating to 1972.",2009,76000000,military,lost / stolen device or media,76000000,20,ITRC,y
Yale University,NA,2010,43000,academic,accidentally published,40000,20,ITRC,n
AT&T,"Details of iPad 3G users hacked from AT&T website, thought to include those of White House chief of staff Rahm Emanuel.",2010,114000,telecoms,hacked,100000,1,Guardian,y
"Ankle & foot Center of Tampa Bay, Inc.","The information hacked included information such as patient names, social security numbers, date of birth, home addressees, account numbers, and healthcare services and related diagnostic codes.",2010,156000,healthcare,hacked,160000,4000,US Gov,n
"Seacoast Radiology, PA","Computer gamers hacked a server at Seacoast Radiology in Rochester in search of more bandwidth in November to play Call of Duty: Black Ops. In the process they also gained access to personal records of the more than 230,000 patients of the health center.",2010,231400,healthcare,hacked,200000,20,US Gov,y
US Federal Reserve Bank of Cleveland,A Malaysian man has been charged with hacking into major US corporations including the US Federal Reserve Bank of Cleveland and FedComp after US Secret Service investigators found more than 400000 stolen credit and debit card account numbers allegedly obtained by hacking into various computer systems of other financial institutions,2010,400000,financial,hacked,400000,300,ITRC,n
Puerto Rico Department of Health,"Double whammy. Two separate breaches. On September 3rd, 2010 data on 115,000 people was stolen from unauthorized access of an electronic device, on the 21st they reported an additional 400,000 records were hacked. ",2010,515000,healthcare,hacked,500000,4000,US Gov,n
Ohio State University,NA,2010,760000,academic,hacked,800000,20,ITRC,n
Gawker.com,"Hacked. 1.5 Million usernames, emails, passwords taken.",2010,1500000,web,hacked,1500000,20,Guardian,n
Betfair,"Betfair waited 18 months to report the breach of their online gambling site, alarming banking institutions and security experts. Betfair's systems breach, which occurred in March and April 2010, was not uncovered until this past May, when a server crashed.",2010,2300000,web,hacked,2300000,300,ITRC,n
Embassy Cables,Wikileaks,2010,251000,government,inside job,300000,50000,Wikileaks,n
US Military,WIKILEAKS!,2010,260000,military,inside job,300000,50000,Guardian,y
Classified Iraq War documents,Wikileaks,2010,392000,government,inside job,400000,20,Forbes,n
Colorado government,NA,2010,105470,healthcare,lost / stolen device or media,100000,20,US Gov,n
Lincoln Medical & Mental Health Center,"130,495 patients lost their protected health information after seven CDs were lost in transit.",2010,130495,healthcare,lost / stolen device or media,130000,4000,US Gov,n
"Emergency Healthcare Physicians, Ltd.","The stolen portable hard drive is believed to have contained records from 2003 to 2006 that included patient names, addressees, phone numbers, birth dates, Social Security numbers, and, in some cases, drivers' license numbers.",2010,180111,healthcare,lost / stolen device or media,180000,4000,US Gov,n
"Triple-S Salud, Inc.",NA,2010,398000,healthcare,lost / stolen device or media,400000,4000,Data Breaches,n
"South Shore Hospital, Massachusetts","South Shore Hospital hired a contractor to destroy files no longer in use and lost the shipment. The back-up computer files possibly contained names, addresses, phone numbers, dates of birth, Social Security numbers, driver’s license numbers, medical record numbers, patient numbers, health plan information, protected health information including diagnoses and treatments. As well as bank account and credit card numbers for some. Patients, employees, physicians, volunteers, donors, vendors and other business partners were effected. ",2010,800000,healthcare,lost / stolen device or media,800000,50000,ITRC,n
New York City Health Hospitals Corp,NA,2010,1700000,healthcare,lost / stolen device or media,1700000,4000,US Gov,n
JP Morgan Chase,"In 2007, the personal information of approximately 2.6 million current and former holders of a Chase-Circuit City credit card had been mistakenly identified as trash and thrown out in garbage bags outside five branch offices in New York.",2010,2600000,financial,lost / stolen device or media,2600000,300,ITRC,y
Educational Credit Management Corp,"A contractor for the US Department of Education stole the records of 3.3 million people. Data included names, addresses, Social Security numbers and dates of birth of borrowers, but no financial or bank account information.",2010,3300000,financial,lost / stolen device or media,3300000,20,ITRC,y
US Army,NA,2011,50000,military,accidentally published,50000,1,ITRC,n
State of Texas,"3.5 million records were accidentally published online including people's names, mailing addresses, social security numbers, and in some cases dates of birth and driver's license numbers.",2011,3500000,government,accidentally published,3500000,20,Information Week,n
Writerspace.com,"Hacker group LulzSec released the e-mails and passwords, 12,000 of which were confirmed to originate from Writerspace.com. ",2011,62000,web,hacked,62000,1,PC Mag,n
University of Wisconsin - Milwaukee,NA,2011,73000,academic,hacked,73000,20,NA,n
US Law Enforcement,AntiSec hackers published 2719 social security numbers 8214 passwords 15798 birth dates 48182 street addresses 1531628 email addresses 106691 phone numbers 57 bank account numbers 53 drivers license numbers and eight credit card numbers of more than 70 different US law enforcement agencies.,2011,123461,government,hacked,130000,300,PC World,n
San Francisco Public Utilities Commission ,NA,2011,180000,government,hacked,180000,1,CNET,n
Bethesda Game Studios,"Hacking collective Lulzsec stole account information of 200,000 user.",2011,200000,gaming,hacked,200000,1,PC World,n
Restaurant Depot,NA,2011,200000,retail,hacked,200000,300,ITRC,n
Epsilon,Apr 2011. Names and email addresses of customers of Barclaycard US Capital One JP Morgan Citigroup and other firms have been stolen.,2011,3000000,web,hacked,3000000,1,The Guardian,n
Massachusetts Government,Over 1500 departmental computers were infected with the W32.QAKBOT virus a malicious program which downloads additional files steals information and opens a back door on the compromised computer.,2011,210000,government,hacked,200000,50000,ITRC,y
Southern California Medical-Legal Consultants,"Electronic files containing names and social security numbers of approximately 300,000 individuals who have applied for California workers’ compensation benefits had been exposed to unauthorized access.",2011,300000,healthcare,hacked,300000,20,ID theft centre,n
Honda Canada,"Names, addresses and vehicle identification numbers were taken from the company’s eCommerce websites myHonda and myAcura",2011,283000,retail,hacked,300000,20,Guelph Mercury,y
Citigroup,"Less than 1% of Citbank card holders' names, account numbers, and contact information such as e-mail addresses were stolen. Card security codes were not stolen. ",2011,360083,financial,hacked,400000,300,PC World,n
Stratfor,"Hacking collective Anonymous defaced the website of Stratfor and posted a file online of the organization’s confidential client list, along with credit card details, passwords and home addresses for those clients. They released 47,680 unique e-mail addresses and 50,277 unique credit card numbers — 9,651 of which were not yet expired. Of the stolen encrypted passwords, 50% were easily crackable. ",2011,935000,military,hacked,900000,300,NY Times,n
Sony Pictures,LulzSec hacking collective stated all of the information it took was unencrypted Sony stored over 1000000 passwords of its customers in plaintext. More than 1 million user accounts were compromised. An additional 75000 music codes and 3.5 million coupons were also uncovered.,2011,1000000,web,hacked,1000000,1,Mashable,y
Oregon Department of Motor Vehicles,"Sheriff's detectives arrested Tim Nuss for accessing an old Oregon Department of Motor Vehicles database. The DMV database was once sold to marketing companies, but the department stopped selling the information in the late 1990s. The sold data include the names, addresses, birth dates, gender and ages of people who registered with the DMV, but no financial information.  ",2011,1000000,government,hacked,1000000,20,ITRC,n
Sega,"Information stolen during the hack includes names, birth dates, e-mail addresses and passwords from Sega Pass, a system for users interested in newsletters and for registering certain products. ",2011,1290755,gaming,hacked,1300000,20,ZD Net,n
Washington Post,Unknown hackers broke into The Washington Posts jobs website stealing about 1.27 million user IDs and email addresses.,2011,1270000,media,hacked,1300000,20,PC Mag,n
China Software Developer Network,NA,2011,6000000,web,hacked,6000000,1,ZD Net,n
178.com,gaming website,2011,10000000,web,hacked,10000000,1,eHacking News,n
Nexon Korea Corp,game developer,2011,13200000,web,hacked,13200000,20,Reuters,n
Sony Online Entertainment,"Hacked by LulzSec. In addition to the Sony Playstation Network breach, compromised 77 million records. More than 23,000 lost financial data, according to Sony.",2011,24600000,gaming,hacked,24600000,300,Computer World,n
Tianya,blogging site,2011,28000000,web,hacked,28000000,1,SC Mag,n
Steam,The Valve Corporation,2011,35000000,web,hacked,35000000,300,BBC News,n
Sony PSN,"Rounding off a thoroughly unhappy year for Sony, their third breach saw the loss of 76,000,000 Sony PSN and Qriocity user accounts to hacking collective Lulzsec.",2011,77000000,gaming,hacked,77000000,1,Mashable,y
Countrywide Financial Corp,mortgage lender,2011,2500000,financial,inside job,2500000,20,LATimes,n
Morgan Stanley Smith Barney,Morgan Stanley mailed a CD containing sensitive data about investors in tax-exempt funds and bonds to the New York State Department of Taxation and Finance. The package arrived at the building but when it arrived at the relevant desk the data CD was missing.,2011,34000,financial,lost / stolen device or media,35000,300,ITRC,y
Memorial Healthcare System,"An employee of an affiliated physician’s office may have improperly accessed patient information through a web portal used by physicians who provide care and treatment at MHS. Specifically, patients’ names, dates of birth, and Social Security numbers.",2011,102153,healthcare,lost / stolen device or media,100000,20,US Gov,n
Spartanburg Regional Healthcare System,"The stolen computer contained a password-protected file with Social Security numbers as well as names, addresses, dates of birth and medical billing codes.",2011,400000,healthcare,lost / stolen device or media,400000,4000,US Gov,n
Eisenhower Medical Center,"Stolen computer contained data listing patients' names, ages, dates of birth, medical record numbers and the last four digits of their social security numbers.",2011,514330,healthcare,lost / stolen device or media,500000,4000,US Gov,n
Nemours Foundation,A health care organization that runs childrens hospitals reported the loss of 1.05 million records when data backup tapes were lost.,2011,1055489,healthcare,lost / stolen device or media,1100000,4000,US Gov,n
Health Net - IBM,"Several server drives, containing personal information of former and current employees, went missing.",2011,1900000,healthcare,lost / stolen device or media,1900000,300,ITRC,n
